{
  "status": "fail",
  "passCount": 4,
  "failCount": 1,
  "durationMs": 1101,
  "logsPath": "logs/lab-tech-landing-trace_last_test_run_7a67f8ce-582b-4216-b28b-b4c0769cdf9b.log",
  "timestamp": "2025-10-10T10:18:31.606Z",
  "command": "npm test",
  "exitCode": 1,
  "startedAt": "2025-10-10T10:18:30.505Z",
  "finishedAt": "2025-10-10T10:18:31.606Z"
}